{
  "kind": "enterprise-agent-provisioning",
  "bundle_id": "22222222-2222-4222-8222-222222222222",
  "pair_id": "11111111-1111-4111-8111-111111111111",
  "profile_version": 1,
  "config": {
    "ENTERPRISE_AGENT_FOUR_EYES_REQUIRED": "false",
    "ENTERPRISE_AGENT_PRODUCTION_MODE": "true",
    "ENTERPRISE_AGENT_SECURE_COOKIE": "false",
    "ENTERPRISE_CAPACITY_BAND": "0.9-1.2Mtpa",
    "ENTERPRISE_COAL_TYPE": "thermal-coal",
    "ENTERPRISE_EXCHANGE_HMAC_SECRET": "example_application_secret_32_bytes_minimum",
    "ENTERPRISE_EXCHANGE_KEY_ID": "mine-qy-001-message-2026q3",
    "ENTERPRISE_MINE_ID": "MINE-QY-001",
    "ENTERPRISE_MINE_NAME": "示例煤矿（仅契约测试）",
    "ENTERPRISE_MINING_METHOD": "underground-longwall",
    "ENTERPRISE_OPERATING_REGIME": "normal-production",
    "ENTERPRISE_OPERATOR_ID": "operator-qy-001",
    "ENTERPRISE_OPERATOR_NAME": "示例企业（仅契约测试）",
    "ENTERPRISE_REPORTING_TIMEZONE": "Asia/Shanghai",
    "ENTERPRISE_SHIFT_SYSTEM": "three-shift-eight-hour",
    "ENTERPRISE_SYSTEM_ID": "agent-mine-qy-001",
    "PLATFORM_V3_BASE_URL": "https://platform.example.internal",
    "PLATFORM_V3_SENDER_ID": "agent-mine-qy-001",
    "PLATFORM_V3_TRANSPORT_HMAC_SECRET": "example_transport_secret_distinct_32_bytes",
    "REGULATORY_EXCHANGE_KEY_ID": "regulator-message-2026q3",
    "REGULATORY_PARTY_ID": "regulator-qinyuan",
    "REGULATORY_SYSTEM_ID": "mineguard-qinyuan"
  },
  "locked_keys": [
    "ENTERPRISE_AGENT_FOUR_EYES_REQUIRED",
    "ENTERPRISE_AGENT_PRODUCTION_MODE",
    "ENTERPRISE_AGENT_SECURE_COOKIE",
    "ENTERPRISE_CAPACITY_BAND",
    "ENTERPRISE_COAL_TYPE",
    "ENTERPRISE_EXCHANGE_HMAC_SECRET",
    "ENTERPRISE_EXCHANGE_KEY_ID",
    "ENTERPRISE_MINE_ID",
    "ENTERPRISE_MINE_NAME",
    "ENTERPRISE_MINING_METHOD",
    "ENTERPRISE_OPERATING_REGIME",
    "ENTERPRISE_OPERATOR_ID",
    "ENTERPRISE_OPERATOR_NAME",
    "ENTERPRISE_REPORTING_TIMEZONE",
    "ENTERPRISE_SHIFT_SYSTEM",
    "ENTERPRISE_SYSTEM_ID",
    "PLATFORM_V3_BASE_URL",
    "PLATFORM_V3_SENDER_ID",
    "PLATFORM_V3_TRANSPORT_HMAC_SECRET",
    "REGULATORY_EXCHANGE_KEY_ID",
    "REGULATORY_PARTY_ID",
    "REGULATORY_SYSTEM_ID"
  ]
}
